rank,title,authors,year,journal,doi,landing_url,pdf_url,pdf_host,publisher,type,language,relevance_score,relation_type,matched_queries,download_status,download_error,filename,pdf_path,text_path,pdf_exists,text_exists
52,On Presenters and Commenters in YouTube Climate Change Videos,Vered Aharonson; Jared Joselowitz,2024,European Conference on Social Media,https://doi.org/10.34190/ecsm.11.1.2076,https://doi.org/10.34190/ecsm.11.1.2076,https://papers.academic-conferences.org/index.php/ecsm/article/download/2076/2050,papers.academic-conferences.org,,article,en,37,direct,direct_yt_climate; direct_yt_comments,downloaded_retry_existing,,"Vered Aharonson, & Jared Joselowitz (2024). On Presenters and Commenters in YouTube Climate Change Videos. European Conference on Social Media.pdf","by_region/pdf_region/Africa/South Africa/Vered Aharonson, & Jared Joselowitz (2024). On Presenters and Commenters in YouTube Climate Change Videos. European Conference on Social Media.pdf","data\text\Vered Aharonson, & Jared Joselowitz (2024). On Presenters and Commenters in YouTube Climate Change Videos. European Conference on Social Media.txt",yes,yes
323,Discourses of climate delay,William F. Lamb; Giulio Mattioli; Sebastian Levi; J. Timmons Roberts; Stuart Capstick; Felix Creutzig; Jan C. Minx; Finn Müller-Hansen; Trevor Culhane; J. Steinberger,2020,Global Sustainability,https://doi.org/10.1017/sus.2020.13,https://doi.org/10.1017/sus.2020.13,https://www.cambridge.org/core/services/aop-cambridge-core/content/view/7B11B722E3E3454BB6212378E32985A7/S2059479820000137a.pdf/div-class-title-discourses-of-climate-delay-div.pdf,www.cambridge.org,Cambridge University Press,article,en,14,direct,social_media_misinfo,downloaded,,"William F. Lamb, et al (2020). Discourses of climate delay. Global Sustainability.pdf","by_region/pdf_region/Europe/Germany/William F. Lamb, et al (2020). Discourses of climate delay. Global Sustainability.pdf","data\text\William F. Lamb, et al (2020). Discourses of climate delay. Global Sustainability.txt",yes,yes
4,Promoting Green Brand of University in Social Media: Text Mining and Sentiment Analysis,Yana Us; Tetyana Pimonenko; Oleksii Lyulyov; Yang Chen; Tatjana Tambovceva,2022,Virtual Economics,https://doi.org/10.34021/ve.2022.05.01(2),https://doi.org/10.34021/ve.2022.05.01(2),https://www.virtual-economics.eu/index.php/VE/article/download/142/98,www.virtual-economics.eu,,article,en,47,direct,direct_yt_climate,downloaded,,"Yana Us, et al (2022). Promoting Green Brand of University in Social Media - Text Mining and Sentiment Analysis. Virtual Economics.pdf","by_region/pdf_region/Europe/Ukraine/Yana Us, et al (2022). Promoting Green Brand of University in Social Media - Text Mining and Sentiment Analysis. Virtual Economics.pdf","data\text\Yana Us, et al (2022). Promoting Green Brand of University in Social Media - Text Mining and Sentiment Analysis. Virtual Economics.txt",yes,yes
34,Shaping climate change discourse: the nexus between political media landscape and recommendation systems in social networks,Yousef Sakieh,2023,Social Network Analysis and Mining,https://doi.org/10.1007/s13278-023-01175-9,https://doi.org/10.1007/s13278-023-01175-9,https://link.springer.com/content/pdf/10.1007/s13278-023-01175-9.pdf,link.springer.com,Springer Science+Business Media,article,en,43,direct,content_analysis; direct_yt_climate; social_media_discourse,downloaded,,Yousef Sakieh (2023). Shaping climate change discourse - the nexus between political media landscape and recommendation systems in social netw. Social Network Analysis and Mining.pdf,by_region/pdf_region/Europe/Finland/Yousef Sakieh (2023). Shaping climate change discourse - the nexus between political media landscape and recom [34-3081736f].pdf,data\text\Yousef Sakieh (2023). Shaping climate change discourse - the nexus between political media landscape and recommendation systems in social netw. Social Network Analysis and Mining.txt,yes,yes
120,Bridging ideologies: analyzing the use of moral language and framing in social media discourse on climate change by U.S. congress members through computational approaches,Yunya Song; Jonathon P. Schuldt; Yin Zhang; Ziwei Wang; Y. Connie Yuan; Sheng Zou; Jun Li,2025,Climatic Change,https://doi.org/10.1007/s10584-025-03898-4,https://doi.org/10.1007/s10584-025-03898-4,https://link.springer.com/content/pdf/10.1007/s10584-025-03898-4.pdf,link.springer.com,Springer Science+Business Media,article,en,26,direct,social_media_discourse; social_media_framing,downloaded,,"Yunya Song, et al (2025). Bridging ideologies - analyzing the use of moral language and framing in social media discourse on climate change by U.S. Climatic Change.pdf","by_region/pdf_region/Asia/Hong Kong/Yunya Song, et al (2025). Bridging ideologies - analyzing the use of moral language and framing in social medi [120-cd24fc5b].pdf","data\text\Yunya Song, et al (2025). Bridging ideologies - analyzing the use of moral language and framing in social media discourse on climate change by U.S. Climatic Change.txt",yes,yes
73,Effective Elements of Climate Change Videos on the YouTube Platform,Zeinab Shahbazi; Sławomir Nowaczyk,2024,European Conference on Social Media,https://doi.org/10.34190/ecsm.11.1.2134,https://doi.org/10.34190/ecsm.11.1.2134,https://papers.academic-conferences.org/index.php/ecsm/article/download/2134/2078,papers.academic-conferences.org,,article,en,34,direct,direct_yt_climate; yt_comm,downloaded_retry,,"Zeinab Shahbazi, & Sławomir Nowaczyk (2024). Effective Elements of Climate Change Videos on the YouTube Platform. European Conference on Social Media.pdf","by_region/pdf_region/Europe/Sweden/Zeinab Shahbazi, & Sławomir Nowaczyk (2024). Effective Elements of Climate Change Videos on the YouTube Platform. European Conference on Social Media.pdf","data\text\Zeinab Shahbazi, & Sławomir Nowaczyk (2024). Effective Elements of Climate Change Videos on the YouTube Platform. European Conference on Social Media.txt",yes,yes
